{
  "schema_version": "3.0",
  "bundle_id": "V3GOLD.MED.KPOP_CDRAMA.SET1",
  "source_manifest": "cbse7_manifest_v3.json",
  "created_at": "2025-12-27T17:51:35Z",
  "items": [
    {
      "item_id": "V3MED.KPOP.SET1.MCQ_CONCEPT.001",
      "atom_id": "CBSE7.CH01.INT.02",
      "template_id": "MCQ_CONCEPT",
      "difficulty": 2,
      "context_tags": [
        "kpop",
        "demon_hunters"
      ],
      "prompt": {
        "text": "K-pop streaming: Yesterday a song was at 12,500 plays. Today it is at 11,950 plays. What is the change (today − yesterday)?",
        "latex": null
      },
      "instruction": "Choose the best answer.",
      "interaction": {
        "type": "mcq_concept",
        "config": {
          "options": [
            {
              "id": "A",
              "text": "+550",
              "diagnostic": {
                "misconception_id": "MIS_1B55BC1E23",
                "confidence": 0.9
              }
            },
            {
              "id": "B",
              "text": "−550"
            },
            {
              "id": "C",
              "text": "+11,950",
              "diagnostic": {
                "misconception_id": "MIS_127F51E42E",
                "confidence": 0.9
              }
            },
            {
              "id": "D",
              "text": "−11,950",
              "diagnostic": {
                "misconception_id": "MIS_127F51E42E",
                "confidence": 0.9
              }
            }
          ],
          "shuffle": true,
          "single_select": true
        }
      },
      "answer_key": {
        "correct_option_id": "B"
      },
      "evidence": [
        {
          "outcome_type": "conceptual"
        },
        {
          "outcome_type": "procedural"
        }
      ]
    },
    {
      "item_id": "V3MED.KPOP.SET1.MCQ_CONCEPT.002",
      "atom_id": "CBSE7.CH08.CQ.02",
      "template_id": "MCQ_CONCEPT",
      "difficulty": 2,
      "context_tags": [
        "cdrama",
        "when_i_fly_towards_you"
      ],
      "prompt": {
        "text": "C‑drama snack budget: A café gives a 20% discount on a ₹250 bill. How much money is discounted?",
        "latex": null
      },
      "instruction": "Choose the best answer.",
      "interaction": {
        "type": "mcq_concept",
        "config": {
          "options": [
            {
              "id": "A",
              "text": "₹50"
            },
            {
              "id": "B",
              "text": "₹230",
              "diagnostic": {
                "misconception_id": "MIS_127F51E42E",
                "confidence": 0.9
              }
            },
            {
              "id": "C",
              "text": "₹20",
              "diagnostic": {
                "misconception_id": "MIS_F5BF26E101",
                "confidence": 0.9
              }
            },
            {
              "id": "D",
              "text": "₹70",
              "diagnostic": {
                "misconception_id": "MIS_127F51E42E",
                "confidence": 0.9
              }
            }
          ],
          "shuffle": true,
          "single_select": true
        }
      },
      "answer_key": {
        "correct_option_id": "A"
      },
      "evidence": [
        {
          "outcome_type": "procedural"
        }
      ]
    },
    {
      "item_id": "V3MED.KPOP.SET1.MCQ_CONCEPT.003",
      "atom_id": "CBSE7.CH03.DATA.04",
      "template_id": "MCQ_CONCEPT",
      "difficulty": 2,
      "context_tags": [
        "kpop",
        "demon_hunters"
      ],
      "prompt": {
        "text": "Fan poll scores: 4, 6, 9, 10, 11. What is the median?",
        "latex": null
      },
      "instruction": "Choose the best answer.",
      "interaction": {
        "type": "mcq_concept",
        "config": {
          "options": [
            {
              "id": "A",
              "text": "8",
              "diagnostic": {
                "misconception_id": "MIS_963499EFB4",
                "confidence": 0.9
              }
            },
            {
              "id": "B",
              "text": "9"
            },
            {
              "id": "C",
              "text": "10",
              "diagnostic": {
                "misconception_id": "MIS_6D0456042E",
                "confidence": 0.9
              }
            },
            {
              "id": "D",
              "text": "40",
              "diagnostic": {
                "misconception_id": "MIS_127F51E42E",
                "confidence": 0.9
              }
            }
          ],
          "shuffle": true,
          "single_select": true
        }
      },
      "answer_key": {
        "correct_option_id": "B"
      },
      "evidence": [
        {
          "outcome_type": "conceptual"
        },
        {
          "outcome_type": "procedural"
        }
      ]
    },
    {
      "item_id": "V3MED.KPOP.SET1.TWO_TIER.004",
      "atom_id": "CBSE7.CH02.FRD.03",
      "template_id": "TWO_TIER",
      "difficulty": 2,
      "context_tags": [
        "cdrama",
        "when_i_fly_towards_you"
      ],
      "evidence": [
        {
          "outcome_type": "conceptual"
        },
        {
          "outcome_type": "logical"
        }
      ],
      "stages": [
        {
          "stage_id": "tier1",
          "prompt": {
            "text": "WIFTY study schedule: Which is bigger, 3/8 or 1/3?",
            "latex": null
          },
          "instruction": "Answer Tier 1 first.",
          "interaction": {
            "type": "mcq_concept",
            "config": {
              "options": [
                {
                  "id": "A",
                  "text": "3/8"
                },
                {
                  "id": "B",
                  "text": "1/3",
                  "diagnostic": {
                    "misconception_id": "MIS_085AC8551F",
                    "confidence": 0.9
                  }
                },
                {
                  "id": "C",
                  "text": "2/5"
                },
                {
                  "id": "D",
                  "text": "4/10",
                  "diagnostic": {
                    "misconception_id": "MIS_127F51E42E",
                    "confidence": 0.9
                  }
                }
              ],
              "shuffle": true,
              "single_select": true
            }
          },
          "answer_key": {
            "correct_option_id": "B"
          },
          "evidence": [
            {
              "outcome_type": "conceptual"
            }
          ],
          "unlock_logic": {
            "show_when": "always",
            "depends_on_stage_id": null,
            "max_attempts": null
          }
        },
        {
          "stage_id": "tier2",
          "prompt": {
            "text": "How did you decide without using a calculator?",
            "latex": null
          },
          "instruction": "Explain in 1–2 sentences.",
          "interaction": {
            "type": "short_explain",
            "config": {
              "rubric_points": [
                "Use a common denominator or compare cross-products.",
                "Mention a clear comparison method."
              ],
              "max_chars": 220
            }
          },
          "answer_key": {
            "key_points": [
              "Convert to common denominator: 3/8 = 9/24 and 1/3 = 8/24, so 3/8 > 1/3 OR cross-multiply: 3×3 ? 1×8."
            ]
          },
          "evidence": [
            {
              "outcome_type": "logical"
            }
          ],
          "unlock_logic": {
            "show_when": "after_stage_correct",
            "depends_on_stage_id": "tier1",
            "max_attempts": 2
          }
        }
      ]
    },
    {
      "item_id": "V3MED.KPOP.SET1.TWO_TIER.005",
      "atom_id": "CBSE7.CH08.CQ.03",
      "template_id": "TWO_TIER",
      "difficulty": 2,
      "context_tags": [
        "kpop",
        "demon_hunters"
      ],
      "evidence": [
        {
          "outcome_type": "conceptual"
        },
        {
          "outcome_type": "logical"
        }
      ],
      "stages": [
        {
          "stage_id": "tier1",
          "prompt": {
            "text": "Merch price: A hoodie costs ₹300. It increases by 10%. What is the new price?",
            "latex": null
          },
          "instruction": "Answer Tier 1 first.",
          "interaction": {
            "type": "mcq_concept",
            "config": {
              "options": [
                {
                  "id": "A",
                  "text": "₹300",
                  "diagnostic": {
                    "misconception_id": "MIS_F5BF26E101",
                    "confidence": 0.9
                  }
                },
                {
                  "id": "B",
                  "text": "₹330"
                },
                {
                  "id": "C",
                  "text": "₹360",
                  "diagnostic": {
                    "misconception_id": "MIS_127F51E42E",
                    "confidence": 0.9
                  }
                },
                {
                  "id": "D",
                  "text": "₹303",
                  "diagnostic": {
                    "misconception_id": "MIS_127F51E42E",
                    "confidence": 0.9
                  }
                }
              ],
              "shuffle": true,
              "single_select": true
            }
          },
          "answer_key": {
            "correct_option_id": "B"
          },
          "evidence": [
            {
              "outcome_type": "procedural"
            }
          ],
          "unlock_logic": {
            "show_when": "always",
            "depends_on_stage_id": null,
            "max_attempts": null
          }
        },
        {
          "stage_id": "tier2",
          "prompt": {
            "text": "Why is it not correct to just add 10 to 300?",
            "latex": null
          },